{"$schema":"https://json-schema.org/draft/2020-12/schema","$id":"https://github.com/jawa-dam/GEI-Research/blob/main/schema/source.schema.json","title":"GEI Source Record","type":"object","additionalProperties":false,"required":["id","type","title","status","version","source_type","title_full"],"properties":{"id":{"type":"string","pattern":"^SRC-[A-Z0-9-]+$"},"type":{"const":"source"},"title":{"type":"string","minLength":1},"status":{"type":"string","enum":["draft","active","deprecated"]},"version":{"type":"string","pattern":"^\\d+\\.\\d+\\.\\d+$"},"source_type":{"type":"string","enum":["primary","secondary","tertiary","dataset","artifact","inscription","website","other"]},"title_full":{"type":"string","minLength":1},"author":{"type":["string","null"]},"date":{"type":["string","null"]},"publisher":{"type":["string","null"]},"url":{"type":["string","null"],"format":"uri"},"accessed":{"type":["string","null"]},"citation":{"type":"string"},"language":{"type":["string","null"]},"license":{"type":["string","null"]},"reliability_notes":{"type":"string"},"notes":{"type":"string"}}}