{"id":"SRC-GEN-001","type":"source","title":"Genesis 1 — KJV","status":"active","version":"1.0.0","source_type":"primary","title_full":"Genesis, Chapter 1, King James Version","author":null,"date":null,"publisher":null,"url":null,"accessed":"2026-09-06","citation":"Genesis 1, King James Version","language":"English translation from Hebrew","license":null,"reliability_notes":"Used as the textual source for the KJV wording under study. Translation-specific observations must be distinguished from claims about the underlying Hebrew text.","notes":"A future source record should document the specific KJV edition/printing used when edition-specific punctuation is analyzed."}